{
  "schemaVersion": 1,
  "runId": "run_example01",
  "source": "linear",
  "ticket": {
    "id": "11111111-1111-4111-8111-111111111111",
    "identifier": "AIDEV-215",
    "teamId": "22222222-2222-4222-8222-222222222222",
    "stateId": "30000000-0000-4000-8000-000000000001",
    "title": "Define contracts",
    "description": "Define generic workflow contracts.",
    "acceptanceCriteria": ["Schemas validate"],
    "labels": ["contracts"],
    "url": "https://linear.app/example/issue/AIDEV-215"
  },
  "repository": {
    "owner": "example",
    "name": "service",
    "baseBranch": "main",
    "baseSha": "aaaaaaaaaaaaaaaaaaaaaaaaaaaaaaaaaaaaaaaa",
    "featureBranch": "squire/aidev-215/run_example01"
  },
  "normalizedAt": "2026-09-01T12:00:00Z"
}
